{
  "version": "2026-06-25",
  "kind": "agent_run.followup_prompt_draft",
  "authority": "metadata_only",
  "cloudRequired": false,
  "executionAllowed": false,
  "draftStatus": "draft_only_until_user_send",
  "intent": "fix",
  "verification": {
    "status": "failed",
    "commandId": "repository-check",
    "exitCode": 1,
    "durationMs": 42000,
    "resultSummary": "Repository check reported one reviewed failure category after the user selected verification.",
    "outputPolicy": "sanitized_bounded_metadata_or_explicit_one_shot_context_only"
  },
  "priorProposal": {
    "proposalId": "proposal:settings-copy-1",
    "label": "Settings copy proposal",
    "status": "applied"
  },
  "planSummary": {
    "planId": "plan:settings-polish-1",
    "title": "Manual settings polish plan",
    "stepLabels": [
      "Review visible settings labels",
      "Prepare a bounded proposal",
      "Suggest a review gate"
    ]
  },
  "userIntentSummary": "Ask the model to draft a smaller follow-up fix using only the reviewed failure category and prior proposal label.",
  "contextPolicy": {
    "allowedSources": [
      "sanitized_verification_metadata",
      "prior_proposal_labels",
      "plan_preview_summary",
      "explicit_user_intent"
    ],
    "forbidRawPrompt": true,
    "forbidRawOutput": true,
    "forbidRawDiffsOrFileBodies": true,
    "forbidPrivatePathsAndSecrets": true
  },
  "manualActionPolicy": {
    "requiresExplicitUserSendClick": true,
    "noAutoSend": true,
    "noAutoApply": true,
    "noAutoVerification": true,
    "noAutoRepair": true,
    "noAutoRollback": true,
    "noExecutionAuthority": true
  }
}
